title,url,link_category_id
Biologic Markers in Immunotoxicology,http://www.nap.edu/catalog/1591.html,1
Experimental Immunotoxicology (M.Holsapple & R.Smialowicz),http://www.amazon.com/gp/product/0849380316/ref=cap_pdp_dp_4/002-0688538-4474419,1
Immunotoxicity and Risk Assessment (D.Flaherty),http://search.barnesandnoble.com/textbooks/booksearch/isbnInquiry.asp?userid=6VXDWE506H&isbn=030645971X&TXT=Y&itm=5,1
T lymphocytes Subpopulations in Immunotoxicology (I.Kimber & MK Selgrade),"http://www.wiley.com/cda/product/0,,0471971944,00.html",1
http://www.amazon.fr/Methods-Immunotoxicology-Gary-R-Burleson/dp/0471305979,http://www.amazon.fr/Methods-Immunotoxicology-Gary-R-Burleson/dp/0471305979,1
Encyclopedic Reference of Immunotoxicology (H-W Vohr),"http://www.springer.com/sgw/cda/frontpage/0,11855,3-40109-22-33836054-0,00.html",1
Immunotoxicology Of Drugs And Chemicals: An experimental and clinical approach. Volume 1. Principles and Methods of Immunotoxicology (J. Descotes),http://www.elsevier.com/wps/find/bookdescription.cws_home/702755/description#description,1
EMEA note for guidance on repeat dose toxicity,http://www.emea.eu.int/pdfs/human/swp/104299en.pdf,2
FDA Guidance for Industry on the Immunotoxicology Evaluation of Investigational New Drugs,http://www.fda.gov/cder/guidance/4945fnl.PDF,2
FDA Immunotoxicity Guidance for Medical Devices,http://www.fda.gov/cdrh/ost/ostggp/immunotox.pdf,2
ICH S8 Immunotoxicity Guideline: Immunotoxicology Studies for Human Pharmaceuticals,http://www.ich.org/LOB/media/MEDIA1706.pdf,2
ICH S6 Preclinical Safety Evaluation of Biotechnology-Derived Pharmaceuticals,http://www.ich.org/LOB/media/MEDIA503.pdf,2
British Toxicology Society Immunotoxicity Speciality Section,http://www.thebts.org/index.php?content=ab_spec#immun,3
Eurotox Immunotoxicology and Chemical Allergy Speciality Section,http://www.eurotox.com/index.html,3
ILSI Immunotoxicology Technical Group,http://www.hesiglobal.org/Committees/TechnicalCommittees/Immunotox/,3
Society of Toxicology Immunotoxicology Specialty Section,http://www.toxicology.org/ISOT/SS/immunotox/Index.html,3
Mouse Local Lymph Node Assay,http://iccvam.niehs.nih.gov/methods/immunotox/llna.htm,4
Ritox,http://www.ritox.vet.uu.nl/ntx.html,5
Access Bio,http://www.accessbio.com/,5
Immunosafe,http://www.immunosafe.fr/,5
Immunologylink,http://www.immunologylink.com/,
ICCVAM,http://iccvam.niehs.nih.gov/,
International Programme on Chemical Safety,http://www.inchem.org/,
Society of Toxicology,http://www.toxicology.org/,
World Wide Web Resources in Toxicology,http://www.uky.edu/Subject/toxicology.html,
